,name,link,lyrics
0,ติด,https://xn--72c9bva0i.meemodel.com//เนื้อเพลง/ติด_ONEONE,"
อาจเพราะว่าเธอไม่เคยให้ฉันเป็นคนสำคัญ 
อาจเพราะว่าฉันนั้นตั้งความหวังมากไป  
สุดท้ายต้องเจ็บ ไม่รู้ทำไม 
ที่ฉันนั้นต้องทุ่มเทให้ฝ่ายเดียว

แต่แล้วเมื่อฉันต้องการจะไปจากชีวิตเธอ 
ก็เหมือนว่าเธอจะให้ความหวังขึ้นมา 
ก็แพ้เธออีก ก็แพ้เธอตลอดมา 
ต้องยอมให้เธอเรื่อยมาไม่เข้าใจ 

*ต้องติดอยู่ตรงนี้ไปนานเท่าไร 
ต้องติดอยู่กับความรักที่เป็นไปไม่ได้   
ไม่รู้ว่าเดินต่อไปแล้วฉันจะเจออะไร 
ยิ่งมองไปก็เจอแต่ความไม่ชัดเจน

แค่อยากจะยอมแพ้ยังทำไม่ไหว 
จะสั่งให้หยุดรักเธอคงทำไม่ได้ 
ยิ่งฝืนจะเดินต่อไป ก็เหมือนไม่มีความหมาย 
ไม่เข้าใจว่ายิ่งทุ่มเทไปเท่าไร 
ทำไมยังติดอยู่ตรงที่เดิม 

ไม่รู้ต้องทน ต้องอยู่อย่างนี้อีกนานเท่าไหร่ 
ไม่รู้เมื่อไรมันจะจบลงสักที 
ตรงนี้มันเจ็บ ความหวังก็ไม่มี 
สุดท้ายไม่มีหนทางให้ฉันไป 

ซ้ำ (*)

ซ้ำ (*)"
1,ปล่อยฉันไป,https://xn--72c9bva0i.meemodel.com//เนื้อเพลง/ปล่อยฉันไป_ONEONE,"
ถ้าเธอคิดว่าเธอทำถูกแล้ว 
ถ้าเธอเลือกแล้วว่าเธอจะไปก็ไป 
ไม่ต้องมาคิดตอนจบ ให้มันดูสวยงามอะไร 
ในเมื่อสุดท้ายแล้วเธอก็ไปไม่ต่างกัน

*เธอบอกว่ายังรัก ยังห่วงใย 
เธอบอกว่าเสียใจที่เธอจะเลือกเดินไปจากฉัน 
แต่เธอเข้าใจไหม ยิ่งทำแบบนั้น 
มันทำให้ฉันยิ่งช้ำใจ

**ก็แค่ปล่อยมือฉันไป 
ยังไงเธอก็จะไปอยู่ดี 
ไม่ต้องมาหาคำพูดอะไรที่ดี มันไม่มี 
ถ้าเธอจะไม่เลือกฉัน
มันอาจจะเจ็บแต่คงไม่นาน 
เวลาที่เหลือก็คงจะลืมเธอสักวัน 
แต่ถ้าไม่มีวันนั้น ก็ปล่อยให้ฉันนั้นทรมานแบบนี้ไป

ตอนจะรักไม่เคยมีเหตุผล 
ถ้าคนจะรักก็ใช้แค่เพียงหัวใจ 
แต่ตอนเธอคิดลาจาก 
เหตุผลเธอนั้นมีมากมาย 
ยิ่งทำร้ายให้ฉันยิ่งเสียใจกว่าเดิม

ซ้ำ *,**
ซ้ำ ** 
ถ้าไม่มีวันนั้น ก็ปล่อยฉัน.."
2,รักษาได้เปล่า,https://xn--72c9bva0i.meemodel.com//เนื้อเพลง/รักษาได้เปล่า_OneOne,"
ฉันกระวนกระวายมันคล้ายว่ามีอาการเจ็บ หัวใจมันมีความอ่อนไหว
เหมือนมันมีอาการเสียด เหมือนมันมีอาการจุกใจ ทำยังไงก็ไม่หาย

* ก็มันไม่รู้ที่เป็นอยู่คืออะไร วอนเธอวินิจฉัยอาการให้ฉันที

** อยู่คนเดียวไม่ได้
ไม่อยากจะไปไหนคนเดียว
ไม่อยากจะต้องพูดคนเดียว
ไม่อยากร้องไห้คนเดียว 
อยากให้เธอมารักษาหัวใจ
คงเจ็บจนทนไม่ได้
ถ้าไม่มีเธออยู่ข้างกาย
ในวันที่ฉันต้องเสียใจ
ให้เธอดูแลได้ไหม
อาการอย่างเงี้ย อยากจะให้เธอรักษาได้เปล่า

เหมือนมันจะไม่หายขาด เหมือนว่ามันจะเป็นหนัก พักเท่าไหร่ก็ยังไม่หาย
ลุกลามไปทั้งหัวใจ เรื้อรังนานเกินไป อ่อนแอทำอะไรก็ไม่ไหว

* ก็มันไม่รู้ที่เป็นอยู่คืออะไร วอนเธอวินิจฉัยอาการให้ฉันที

** อยู่คนเดียวไม่ได้
ไม่อยากจะไปไหนคนเดียว
ไม่อยากจะต้องพูดคนเดียว
ไม่อยากร้องไห้คนเดียว 
อยากให้เธอมารักษาหัวใจ
คงเจ็บจนทนไม่ได้
ถ้าไม่มีเธออยู่ข้างกาย
ในวันที่ฉันต้องเสียใจ
ให้เธอดูแลได้ไหม
อาการอย่างเงี้ย อยากจะให้เธอรักษาได้เปล่า

** อยู่คนเดียวไม่ได้
ไม่อยากจะไปไหนคนเดียว
ไม่อยากจะต้องพูดคนเดียว
ไม่อยากร้องไห้คนเดียว 
อยากให้เธอมารักษาหัวใจ
คงเจ็บจนทนไม่ได้
ถ้าไม่มีเธออยู่ข้างกาย
ในวันที่ฉันต้องเสียใจ
ให้เธอดูแลได้ไหม
อาการอย่างเงี้ย อยากจะให้เธอรักษาได้เปล่า"
3,วังวน,https://xn--72c9bva0i.meemodel.com//เนื้อเพลง/วังวน_ONEONE,"
เพราะมีความรัก ฉันเลยเป็นคนที่อ่อนแอ
ต้องพบกับความพ่ายแพ้ ที่วนเวียนซ้ำอย่างทุกข์ทน
ทุกครั้งมันคอยตอกย้ำ เจ็บแล้วไม่จำไม่ใช่คน
ถ้าต้องการหลุดจากวังวน ต้องไม่ยอมทนอยู่อย่างนี้

จะเลิกเอาใจไปรัก คนที่ไม่รักเรา
จะเลิกเอาใจไปทิ้งให้เจ็บให้ปวดร้าว
เพราะทำดีเท่าไหร่ ก็ได้เพียงความว่างเปล่า
ถ้าหากทุ่มเทให้คนที่ไม่มีหัวใจ

จะต้องเป็นคนเข้มแข็งต่อจากนี้ไป
จะเลิกเป็นคนอ่อนไหวให้คนที่ทำร้ายกัน
แต่คิดจะลืมเท่าไหร่ กลับไม่เคยลืมสักวัน
มันไม่เข้าใจทำไม สุดท้ายก็ยังไปรักเธอ

เพราะว่าเธอคนนี้ ที่มีให้เพียงความผิดหวัง
เคยเสียน้ำตากี่ครั้ง หัวใจก็ยังให้อภัย
ทุกครั้งมันเป็นคำถาม เจ็บนี้จะนานถึงเมื่อไหร่
ถ้าไม่ยอมตัดขาดเธอไป ต้องเจ็บวนไปอยู่อย่างนี้"
4,วังวน,https://xn--72c9bva0i.meemodel.com//เนื้อเพลง/วังวน_OneOne,"
เพราะมีความรัก ฉันเลยเป็นคนที่อ่อนแอ
ต้องพบกับความพ่ายแพ้ ที่วนเวียนซ้ำอย่างทุกข์ทน
ทุกครั้งมันคอยตอกย้ำ เจ็บแล้วไม่จำไม่ใช่คน
ถ้าต้องการหลุดจากวังวน ต้องไม่ยอมทนอยู่อย่างนี้

จะเลิกเอาใจไปรัก คนที่ไม่รักเรา
จะเลิกเอาใจไปทิ้งให้เจ็บให้ปวดร้าว
เพราะทำดีเท่าไหร่ ก็ได้เพียงความว่างเปล่า
ถ้าหากทุ่มเทให้คนที่ไม่มีหัวใจ

จะต้องเป็นคนเข้มแข็งต่อจากนี้ไป
จะเลิกเป็นคนอ่อนไหวให้คนที่ทำร้ายกัน
แต่คิดจะลืมเท่าไหร่ กลับไม่เคยลืมสักวัน
มันไม่เข้าใจทำไม สุดท้ายก็ยังไปรักเธอ

เพราะว่าเธอคนนี้ ที่มีให้เพียงความผิดหวัง
เคยเสียน้ำตากี่ครั้ง หัวใจก็ยังให้อภัย
ทุกครั้งมันเป็นคำถาม เจ็บนี้จะนานถึงเมื่อไหร่
ถ้าไม่ยอมตัดขาดเธอไป ต้องเจ็บวนไปอยู่อย่างนี้"
5,อยากนอน,https://xn--72c9bva0i.meemodel.com//เนื้อเพลง/อยากนอน_ONEONE,"
* แค่อยากจะนอนไม่ต้องมาวุ่นวาย 
ถ้าไม่รับสายไม่ตอบไลน์ก็อย่ามาว่ากัน 
แค่อยากจะนอนอยู่เฉยๆ อย่างนี้ทั้งวัน
คิดว่าสงสารคนที่เหนื่อยมาหลายวัน ฉันขอตัวไปนอน

ตื่นขึ้นมาตอนเช้าแทบลุกไม่ไหว 
ติดอยู่บนถนนแทบไม่เคลื่อนไหว 
อยู่บนรถนานจะหลับใน เส้นทางก็อีกไกล โอ๊ยเพลีย 
แดด ก็สุดจะร้อน ทำอารมณ์เสีย
ตาจะปิดอยู่แล้ว I'm so งัวเงีย
ก็สมองมันเริ่มอ่อนเพลีย ไม่ไหวที่จะเคลียร์ โอ๊ย โอย

อยากจะหลับตา มันอ่อนล้าเกินไป 
อยากทำอะไร ก็เหนื่อยไม่หายสักที
เริ่มทนไม่ไหว อยากปิดไฟ ยอมแพ้โดยดี 
คงมีสิ่งเดียว สิ่งที่ดีที่ร่างกายของฉันต้องการ 

* แค่อยากจะนอนไม่ต้องมาวุ่นวาย 
ถ้าไม่รับสายไม่ตอบไลน์ก็อย่ามาว่ากัน 
แค่อยากจะนอนอยู่เฉยๆ อย่างนี้ทั้งวัน
คิดว่าสงสารคนที่เหนื่อยมาหลายวัน ฉันขอตัวไปนอน

มันเหนื่อยมันเมื่อยมันง่วงมันปวดมันล้า แค่อยากจะนอน
บางทีขี้เกียจมากๆ ไม่อยากทำไร แค่อยากจะนอน
บางทีอากาศดีๆ ฝนฟ้าเป็นใจ แค่อยากจะนอน
ไม่อยากรับรู้ ไม่อยากวุ่นวาย ไม่อยากเซ้าซี้ แค่อยากจะนอน
อะไรที่เค้าว่าดีไม่สนตอนนี้ แค่อยากจะนอน
ขี้เกียจจะทำแล้วงานอยากกลับไปบ้าน แค่อยากจะนอน
“เฮ้ยเพื่อนไปเที่ยวกันปะ !?” เฮ้ยไม่ไป แค่อยากจะนอน
ได้โปรดอย่ามารบกวน อย่าส่งเสียงดัง (แค่อยากจะนอน)

* แค่อยากจะนอนไม่ต้องมาวุ่นวาย 
ถ้าไม่รับสายไม่ตอบไลน์ก็อย่ามาว่ากัน 
แค่อยากจะนอนอยู่เฉยๆ อย่างนี้ทั้งวัน
คิดว่าสงสารคนที่เหนื่อยมาหลายวัน ฉันขอตัวไปนอน

* แค่อยากจะนอนไม่ต้องมาวุ่นวาย 
ถ้าไม่รับสายไม่ตอบไลน์ก็อย่ามาว่ากัน 
แค่อยากจะนอนอยู่เฉยๆ อย่างนี้ทั้งวัน
คิดว่าสงสารคนที่เหนื่อยมาหลายวัน ฉันขอตัวไปนอน"
