,name,link,lyrics
8,ไปเถอะเธอ,https://xn--72c9bva0i.meemodel.com//เนื้อเพลง/ไปเถอะเธอ_Three%20Man%20Down,"
ไปเถอะเธอ ไปที่ที่ดีกว่า หากอยู่กับฉันเสียเวลา
สุดท้ายไม่นานฉันคงเข้าใจ
ไปเถอะเธอ ทิ้งฉันไว้ดีกว่า อย่ามัวแต่เสียน้ำตา
เรื่องของเรา ปล่อยมันเอาไว้

เพราะว่าที่ผ่านมา จนวันนี้
ฉันรู้ตัวดี ว่ายังดีไม่พอ
เมื่อเธอเลือกแล้ว ก็ควรต้องเดินจากไป
อย่าห่วงฉัน เจ็บแค่ไหนฉันจะทนไว้

เพราะชีวิตเธอรออยู่ ที่หลังประตูบานนั้น
ฉันคงไม่อาจจะรั้งเธอเอาไว้

ไม่ต้องรู้สึกผิดกับเรื่องนี้หรอกที่รัก
เพราะว่าคนเราเปลี่ยนไปได้ทุกวัน
เมื่อความรักไม่มีเหตุผลคนแพ้ก็ต้องทน
อยู่และดูเขารักกัน ให้ไหว"
9,ฝนตกไหม,https://xn--72c9bva0i.meemodel.com//เนื้อเพลง/ฝนตกไหม_Three%20Man%20Down,"
(ในคืนที่ฝนโปรยลงมา)

ฝนตกอีกแล้ว คืนนี้คงหนาวกว่าคืนไหนไหน
ตัวฉันก็ใช้ชีวิตไป แค่ผ่านผ่านไป เท่านั้น เท่านั้น

ก็คิดถึงเธอ อยากรู้ว่าเธอน่ะเป็นเช่นไร
ตัวฉันก็เลยกดเบอร์โทรไป แบบไม่ตั้งใจ เท่านั้น เท่านั้น

แค่อยากจะรู้ว่าตรงที่เธอยืนนั้น มีฝนตกไหม สบายดีไหม
เธอกลัวฟ้าร้องหรือเปล่า
ถ้าหากตรงนั้นไม่มีใคร ฉันพร้อม ฉันพร้อมจะไป 
ในคืนที่ฝนโปรยลงมา

อากาศชื้นนะคืนนี้ ระวังหนาวนะแบบนี้
ก่อนเข้านอนเป่าผมให้ดี ฉันกลัวเธอจะไม่สบาย
ที่โทรมาหาเธอ กดมาแบบไม่ได้ตั้งใจ
ไม่ได้คิดอะไร แค่กลัวเธอไม่สบาย (เท่านั้น เท่านั้น)

แค่อยากจะรู้ว่าตรงที่เธอยืนนั้น มีฝนตกไหมสบายดีไหม
เธอกลัวฟ้าร้องหรือเปล่า
ถ้าหากตรงนั้นไม่มีใคร ฉันพร้อม ฉันพร้อมจะไป 

แต่ฉันก็รู้ดีว่าข้างข้างเธอนั้น 
มีเขาใช่ไหม และคนคนนั้น ดูแลเธอดีหรือเปล่า
ถ้าเธอยิ้มฉันก็ดีใจ แค่ตรงนี้ฉันไม่มีใคร
ในคืนที่ฝนโปรยลงมา"
10,ฝันถึงแฟนเก่า,https://xn--72c9bva0i.meemodel.com//เนื้อเพลง/ฝันถึงแฟนเก่า_Three%20Man%20Down,"
ในกลางดึกคืนหนึ่งฉันฝันถึงเธอ
ภาพเธอยังคงสวยงามอย่างเคย
มันก็ตั้งนานแล้วที่เราไม่เจอ
แต่ฉันไม่เคยจะลืมเธอสักที

ฝันถึงแฟนเก่าในฝันมันช่างดี
เหมือนไม่เคยเก่า และเหมือนว่าเธอยังอยู่ตรงนี้
เพราะด้วยเรื่องต่าง ๆ มากมายในวันนั้น
ที่ทำให้เราไม่ได้ไปกันต่อ จนถึงวันนี้

ได้แต่สงสัยว่าถ้าวันนั้น ฉันไม่ทำเธอเสียใจ
เราจะยังคบกันอยู่ไหม เธอยังจะรักฉันใช่ไหม
แล้วถ้ายังคบกันในวันนี้ คงมีความสุขใช่ไหม
แต่มันก็คงสายไป เพราะในวันนี้ฉันทำได้แค่ฝันถึงแฟนเก่า

ที่ยังเป็นแบบนี้คงเพราะลึกลงไป
หมดทั้งหัวใจ ฉันมีแต่เธอ

ฝันถึงแฟนเก่า ในฝันมันช่างดี
เหมือนไม่เคยเก่า และเหมือนว่าเธอยังอยู่ตรงนี้
เพราะด้วยเรื่องต่าง ๆ มากมายในวันนั้น
ที่ทำให้เราไม่ได้ไปกันต่อ จนถึงวันนี้

ได้แต่สงสัยว่าถ้าวันนั้น ฉันไม่ทำเธอเสียใจ
เราจะยังคบกันอยู่ไหม เธอยังจะรักฉันใช่ไหม
แล้วถ้ายังคบกันในวันนี้ คงมีความสุขใช่ไหม
แต่มันก็คงสายไป เพราะในวันนี้ฉันทำได้แค่ฝันถึงแฟนเก่า

หากตอนนั้นตัวฉันไม่ทำอะไรพลาดไป เราจะรักกันอยู่ไหม เธอจะไม่หายไปใช่ไหม เพราะในวันนี้ฉันเพิ่งรู้ ไม่มีเธอคงไม่ไหว ขอเธอกลับมาจะได้ไหม เพราะในวันนี้ วันนี้

ได้แต่สงสัยว่าถ้าวันนั้น ฉันไม่ทำเธอเสียใจ
เราจะยังคบกันอยู่ไหม เธอยังจะรักฉันใช่ไหม
แล้วถ้ายังคบกันในวันนี้ คงมีความสุขใช่ไหม
แต่มันก็คงสายไป เพราะในวันนี้ฉันทำได้แค่ฝันถึงแฟนเก่า"
11,ไม่เคยมีดาวในเมืองใหญ่,https://xn--72c9bva0i.meemodel.com//เนื้อเพลง/ไม่เคยมีดาวในเมืองใหญ่_Three%20Man%20Down,"
อีกไม่กี่ชั่วโมงก็เช้าแล้ว
ทำไมฉันไม่หลับสักที
เปิดไปเจอภาพเธอในทีวี
ฉันคิดถึงเธอมากเหลือเกิน

ก็ไม่เคยคิดถึงใคร ขนาดนี้มาก่อน
อยากฝากความรักของฉันไปกับดาวบนฟ้า
แต่มันก็น่าเศร้าใจ ไม่เคยมีดาวในเมืองใหญ่
มองไปทีไรมีเพียงแสงไฟของรถยนต์

อีกไม่กี่นาทีก็เช้าแล้ว
ดูเหมือนว่าฉันคงไม่ได้นอน
ก็เลยเปิดเพลงฟัง เพลงที่เธอแชร์ไว้วันก่อน
หวังว่าคงร้องให้เธอฟังสักวัน

ก็ไม่เคยคิดถึงใคร ขนาดนี้มาก่อน
อยากฝากความรักของฉันไปกับดาวบนฟ้า
แต่มันก็น่าเศร้าใจ ไม่เคยมีดาวในเมืองใหญ่
มองไปทีไรมีเพียงแสงไฟของรถยนต์

แต่มันก็น่าเศร้าใจ ไม่เคยมีดาวในเมืองใหญ่
มองไปทีไรมีเพียงแสงไฟของรถยนต์

แต่มันก็น่าเศร้าใจ ไม่เคยมีดาวในเมืองใหญ่
มองไปทีไรมีเพียงแสงไฟของรถยนต์"
12,เลือกคนที่เขารักเรา,https://xn--72c9bva0i.meemodel.com//เนื้อเพลง/เลือกคนที่เขารักเรา_Three%20Man%20Down,"
เธอมาถามว่าเหนื่อยไหม ที่ต้องคอยซับน้ำตาให้เธอ
ในวันที่เขาทำร้ายเธอมา
ฉันแค่ยิ้มแกล้งหัวเราะแล้วก็ตอบเธอไป ไม่เป็นไร 
ให้เธอห่วงตัวเองพอแล้ว

ทั้งที่ในใจ อยากจะกอดเธอเอาไว้ ไม่ให้กลับไปหาเขา

ถ้าเขาไม่รักเธอควรจะพักก่อนดีไหม
ถ้าเขาไม่รักฉันว่าเธอควรจะปล่อยเขาไป
ให้ฉันคนนี้ ให้ฉันคนนี้กอดเธอไว้
เพราะเธอก็รู้ว่าฉันไม่เคยทำเธอเสียใจ

ฉันก็ถามเธอเหนื่อยไหมที่ต้องคอยเสียน้ำตาให้กับเขา
จนเธอไม่รู้เป็นครั้งที่เท่าไหร่
เธอก็คิดแล้วก็ร้องไห้อีกครั้ง สิ่งเดียวที่ต้องการ
ก็คือเธออยากเจอแต่เขา

ฉันต้องทำยังไง อยากจะกอดเธอเอาไว้ ไม่ให้กลับไปหาเขา

ถ้าเขาไม่รักเธอควรจะพักก่อนดีไหม
ถ้าเขาไม่รักฉันว่าเธอควรจะปล่อยเขาไป
ให้ฉันคนนี้ ให้ฉันคนนี้กอดเธอไว้
เพราะเธอก็รู้ว่าฉันไม่เคยทำเธอเสียใจ

เธอแค่ต้องเลือกสิ่งที่ดีที่สุดใช่ไหม
แต่ฉันไม่รู้เลยว่าเขามีดียังไง
เธอถึงได้รักเขาไปหมดทั้งหัวใจ
ลองเปลี่ยนมาเลือกคนที่เขารักเราได้ไหม

ถ้าเขาไม่รักเธอควรจะพักก่อนดีไหม
ถ้าเขาไม่รักฉันว่าเธอควรจะปล่อยเขาไป
ให้ฉันคนนี้ ให้ฉันคนนี้กอดเธอไว้
เพราะเธอก็รู้ว่าฉันไม่เคยทำเธอเสียใจ

ถ้าเขาไม่รักเธอควรจะพักก่อนดีไหม
ถ้าเขาไม่รักฉันว่าเธอควรจะปล่อยเขาไป
ให้ฉันคนนี้ ให้ฉันคนนี้กอดเธอไว้
เพราะเธอก็รู้ว่าฉันไม่เคยทำเธอเสียใจ"
13,วันเกิดฉันปีนี้,https://xn--72c9bva0i.meemodel.com//เนื้อเพลง/วันเกิดฉันปีนี้_Three%20Man%20Down,"
วนมาอีกปีแล้ววันเกิดฉันที่ไม่มีเธอ
ออกไปเจอใครก็เหมือนเดิม
ไม่มีใครที่เป็นเหมือนเธอ
กลับมาที่ห้องนอนกับเค้กหนึ่งปอนด์
จุดเทียนอธิษฐานเหมือนที่เธอเคยบอกฉันในตอนนั้น

มีเพียงพรข้อเดียวที่ฉันอยากจะขอ
และเป็นเพียงข้อเดียวที่ฉันยังเฝ้ารอ
อยากให้เธออยู่ด้วยกัน 
อยากให้เธออยู่ด้วยกันเหมือนเคย

วันเกิดฉันปีนี้ขอเธอกลับมาได้ไหม
ให้เธอกอดฉันเอาไว้อีกครั้ง
เหมือนวันนั้นที่เราเคยรักกัน
Happy birthday to me
ฉันยังรอเธอตรงนี้เสมอ
ถึงแม้รู้ว่าเธอคงไม่กลับมา

นึกถึงปีนั้นที่อยู่ด้วยกัน
เปิดกล่องของขวัญที่เธอให้ฉัน
พูดถึงเรื่องความฝันที่อยากทำด้วยกัน
ก็ไม่รู้ความฝันของเธอเหมือนเดิมไหม
ฉันวิ่งไล่ตามมันทุกวันอย่างตั้งใจ
หากว่าสักวันหนึ่งที่ฉันทำได้เธอจะกลับมาไหม

มีเพียงพรข้อเดียวที่ฉันอยากจะขอ
และเป็นเพียงข้อเดียวที่ฉันยังเฝ้ารอ
อยากให้เธออยู่ด้วยกัน 
อยากให้เธออยู่ด้วยกันเหมือนเคย

วันเกิดฉันปีนี้ขอเธอกลับมาได้ไหม
ให้เธอกอดฉันเอาไว้อีกครั้ง
เหมือนวันนั้นที่เราเคยรักกัน
Happy birthday to me
ฉันยังรอเธอตรงนี้เสมอ
ถึงแม้รู้ดีว่าเธอคงไม่กลับมา

ถ้าฉันอธิษฐานด้วยหัวใจ
เราจะได้พบกันไหม
เพียงคำขอเดียวในวันเกิดฉัน
จะเป็นจริงได้ไหม

มีเพียงพรข้อเดียวที่ฉันอยากจะขอ
และเป็นเพียงข้อเดียวที่ฉันยังเฝ้ารอ
อยากให้เธออยู่ด้วยกัน 
อยากให้เธออยู่ด้วยกันเหมือนเคย

วันเกิดฉันปีนี้ขอเธอกลับมาได้ไหม
ให้เธอกอดฉันเอาไว้อีกครั้ง
เหมือนวันนั้นที่เราเคยรักกัน
Happy birthday to me
ฉันยังรอเธอตรงนี้เสมอ
ถึงแม้รู้ดีว่าเธอคงไม่กลับมา

ถ้าฉันอธิษฐานด้วยหัวใจ
เราจะได้พบกันไหม
เพียงคำขอเดียวในวันเกิดฉัน
จะเป็นจริงได้ไหม"
14,หมดไอจี,https://xn--72c9bva0i.meemodel.com//เนื้อเพลง/หมดไอจี_Three%20Man%20Down,"
ดันไปแอบชอบคนที่เขานั้นคงไม่ชอบกลับมา
แล้วตัวฉันต้องทำเช่นไร กดฟอลโล่วไปเธอไม่ฟอลกลับมา
ต่อให้ฉันนั้นไลก์รูปเธอจนหมดไอจีก็ไม่มีทีท่า
ว่าเธอนั้นจะมองกลับมา จะมองกลับมาที่ฉันสักหน่อย

แอบไปไลก์รูปเธอสักหน่อย
ส่องสตอรี่เธอบ่อย ๆ
ไลก์ให้รู้ว่ารักแล้วอีกสักพักฉันคงจะทักไป
แอบไปไลก์รูปเธอสักหน่อย
ส่องสตอรี่เธอบ่อย ๆ
ไลก์ให้รู้ว่ารักแล้วอีกสักพักฉันคงจะบ้าตาย

ดันไปแอบชอบคนที่เขานั้นคงไม่ชอบกลับมา
แล้วตัวฉันต้องทำเช่นไร กดฟอลโล่วไปเธอไม่ฟอลกลับมา
ต่อให้ฉันนั้นไลก์รูปเธอจนหมดไอจีก็ไม่มีทีท่า
ว่าเธอนั้นจะมองกลับมา จะมองกลับมาที่ฉันสักหน่อย

ดันไปแอบชอบคนที่เขานั้นคงไม่ชอบกลับมา
แล้วตัวฉันต้องทำเช่นไร กดฟอลโล่วไปเธอไม่ฟอลกลับมา
ต่อให้ฉันนั้นไลก์รูปเธอจนหมดไอจีก็ไม่มีทีท่า
ว่าเธอนั้นจะมองกลับมา จะมองกลับมาที่ฉันสักหน่อย

ดันไปแอบชอบคนที่เขานั้นคงไม่ชอบกลับมา
แล้วตัวฉันต้องทำเช่นไร กดฟอลโล่วไปเธอไม่ฟอลกลับมา
ต่อให้ฉันนั้นไลก์รูปเธอจนหมดไอจีก็ไม่มีทีท่า
ว่าเธอนั้นจะมองกลับมา จะมองกลับมาที่ฉันสักหน่อย"
15,อยากฟัง,https://xn--72c9bva0i.meemodel.com//เนื้อเพลง/อยากฟัง_Three%20Man%20Down,"
เห็นเธอจมอยู่กับควันและคราบน้ำตา
ฉันไม่รู้ว่าใครทำร้ายเธอมา
แต่ดูเธอบอบช้ำ
อยากให้เธอลองบอกฉัน
เพราะฉันเป็นห่วงเธอ

เล่าให้ฉันฟัง เรื่องที่เธอเจอ
เผื่อว่ามันจะบรรเทา
แบ่งมาให้ฉันถ้าเธอไม่อยากจำ
เพราะว่าฉันนั้นอยากจะฟัง

เช็ดน้ำตาที่ยังไหลทิ้งไปดีกว่า
ให้เธอทนไว้มันคงไม่นาน
ความเศร้าจะจางหาย
ผ่านคืนที่เลวร้าย
แค่เธอบอกมา

เล่าให้ฉันฟัง เรื่องที่เธอเจอ
เผื่อว่ามันจะบรรเทา
แบ่งมาให้ฉันถ้าเธอไม่อยากจำ
เพราะว่าฉันนั้นอยากจะฟัง (เอ้า)
แค่เธอบอกมา

เล่าให้ฉันฟัง เรื่องที่เธอเจอ
เผื่อว่ามันจะบรรเทา
แบ่งมาให้ฉันถ้าเธอไม่อยากจำ
เพราะว่าฉันนั้นอยากจะฟัง

เล่าให้ฉันฟัง เรื่องที่เธอเจอ
เผื่อว่ามันจะบรรเทา
แบ่งมาให้ฉันถ้าเธอไม่อยากจำ
อยากจะฟังเสียงเธอจนเช้า"
16,อยู่ในสาย,https://xn--72c9bva0i.meemodel.com//เนื้อเพลง/อยู่ในสาย_Three%20Man%20Down,"
ขอร้องได้ไหม อย่าเพิ่งตัดสาย
ฉันคิดถึงเธอเหลือเกิน ขอแค่ได้ยินเพียงเสียงเธอ
ขอร้องได้ไหม อย่าเพิ่งผลักไส
ฉันไม่ต้องการมากมาย
แค่เรื่องเดียว ที่จะขอ

ขอแค่เพียงไม่กี่นาที
ให้เราได้คุยกันแบบนี้
นับเป็นช่วงเวลาที่ดี เหลือเกิน
I just want to talk to you,be in love with you forever

ขอแค่เธออยู่ในสาย แค่เธอยังอยู่ในสาย ก็พอ
อย่าเพิ่งวางนะฉันขอ
แม้เราไม่ได้พบกัน แค่เพียงได้ยินเสียงนั้น ก็พอ
เปลี่ยนคืนที่อ้างว้างให้มีความหมาย

ในทุกๆถ้อยคำที่เธอพูดมา
ทำให้ฉันอบอุ่นไปทั้งหัวใจ
เสียงของเธอนั้นเพราะกว่าเพลงใดๆ
ที่ฉันนั้นเคยได้ฟัง
ขอให้ดาว โปรดช่วยฉันหน่อยได้ไหม
ช่วยผู้ชายคนนี้ ให้ได้สมหวังสักครั้ง
แค่เรื่องเดียว ที่จะขอ

I just want to, I’m falling for you
อยากให้เธอรู้ ฉันยอมทุกอย่าง ให้เธอลองมองไปนอกหน้าต่าง
หัวใจฉันลอยอยู่บนฟ้าไกล
I just want to, I’m falling for you
ขอแค่ได้รู้เธอยังไม่วาง เสียงของเธอคือทุกๆอย่าง
เปลี่ยนคืนที่อ้างว้างให้มีความหมาย"
