,name,link,lyrics
8,ซุปเปอร์ไซย่า,https://xn--72c9bva0i.meemodel.com//เนื้อเพลง/ซุปเปอร์ไซย่า_URBOYTJ,"
HOOK
อยากใส่ Converse ละเข้าไปเตะหน้ามึง
ถีบสองตีนละกูก็เก๊กท่านึง
ฝากรอยตีนเอาไว้ที่แก้มมึงข้างนึง
ยั๊วะเลยไอ้สัส มึงทำกูเป็นอีกร่างนึง
อยากใส่ Jordan วิ่งเข้าไปเตะหน้ามึง
กระโดดถีบสองตีน แล้วกูก็เก๊กท่านึ่ง
อยากฝากรอยตีนเอาไว้ที่แก้มมึงข้างนึง 
ยั๊วะเลยไอ้สัส มึงทำกูเป็นอีกร่างนึง ไอเหี้ย

VERSE TJ
กูหนะโหดสัสยิ่งกว่าซุปเปอร์ไซย่า
ใครหน้าไหน กูก็จะไม่ไว้หน้า
ฆ่ามึงตาย แบบยิ่งกว่ายาฆ่าหญ้า
ฝากรอยตีนเอาไว้ที่บนใบหน้า
กูปล่อยพลังคลื่นเต่าเหมือนกับโกคู
เบสกูกระแทก จนกระโหลกพวกมึงยุบ
เงินและทอง ของที่แพงๆ มึงยังหามาได้ไม่เท่ากู
Dark สัสเลย นึกว่า DC
หลีกไป เวลามึง See me
ใครบอกว่ากูไม่มีดี
กู Headshot ละบอกว่า GG
บนตีนกู Nike 
เหยียบหน้ามึงเละเหมือนกับตอนกูย่ำขี้
บอกว่า กูเป็นอย่างนั้นเป็นอย่างนี้ถ้าไม่รู้จักกูดี
ช่วยเลิกเห่ากันซักที

HOOK
อยากใส่ Air Force วิ่งเข้าไปเตะหน้ามึง
กระโดดถีบสองตีน แล้วกูก็เก๊กท่านึ่ง
อยากฝากรอยตีนเอาไว้ที่แก้มมึงข้างนึ่ง 
ยั๊วะเลยไอ้สัส มึงทำกูเป็นอีกร่างนึง ไอเหี้ย
อยากใส่ Converse ละเข้าไปเตะหน้ามึง
ถีบสองตีนละกูก็เก๊กท่านึง
ฝากรอยตีนเอาไว้ที่แก้มมึงข้างนึง
ยั๊วะเลยไอ้สัส มึงทำกูเป็นอีกร่างนึง

VERSE MAIYARAP
อยากจะเตะหน้ามึงแบบว่าจังๆอะ ขอแบบเสียงดังๆ ฟังละแบบแน่นๆ 
แหม่ ถ้ามึงล้มแล้วหน้ามึงแนบกับพื้นนะ 
หื้ม จะประเคนส้นตีนให้แบบแม่นๆ 
เห็นมึงโชว์เฟี้ยว อยากเดี่ยวอ่ะ อย่าแพล่ม 
เห็นมึงโชว์พาว ราวกับหมาจะมาแง่ม 
ไรม์คมๆคุณภาพดีๆ ไม่เหมาะกับหน้า... 
ของคนอย่างแม่ง
อยากใส่ Jordan ไปย่ำหน้ามึงจัง 
เจอกันต่อหน้ามึงอย่าให้เพื่อนมึงบัง 
ตัวกูเล็กกว่าแต่ล่อหน้ามึงพัง 
เห้ยๆ อย่าเงียบดิก็กูคิดถึงมึงจัง 
เห็นมึงอยากเกิด เดี๊ยวกูจะเป่าให้ดับ 
ขอแค่ทีเดียวสัญญาจะเอาให้หลับ 
แบบว่าคาตีนกูไม่มีซีนให้สับ 
มึงอยากหลับเพราะคู่ไหนก็เลือกเอาไอ้สัส

HOOK
อยากใส่ Converse ละเข้าไปเตะหน้ามึง
ถีบสองตีนละกูก็เก๊กท่านึง
ฝากรอยตีนเอาไว้ที่แก้มมึงข้างนึง
ยั๊วะเลยไอ้สัส มึงทำกูเป็นอีกร่างนึง
อยากใส่ ช้างดาว วิ่งเข้าไปเตะหน้ามึง
กระโดดถีบสองตีน แล้วกูก็เก๊กท่านึ่ง
อยากฝากรอยตีนเอาไว้ที่แก้มมึงข้างนึง 
ยั๊วะเลยไอ้สัส มึงทำกูเป็นอีกร่างนึง ไอเหี้ย

BRIDGE TJ
อย่าให้กูต้องเดือดเวลาที่เลือดมันขึ้นบนหน้า 
เพราะว่ากูซ่ายิ่งกว่าโซดา 
ถ้ายังไม่เชื่อมึงลองเข้ามา 
ตอนนี้กูร่างซุปเปอร์ไซย่า
จะฝากส้นตีนไว้ที่หน้า 
ส่วนมึงเป็นได้แค่เศษสวะ
สุดท้ายต้องทิ้งไปลงขยะ
แล้วกูไม่สนมึงมาจากไหน  
ละใครจะพาพวกมึงเข้ามา
เพราะเวลาเดียวที่มึงจะไป 
คือเวลาที่มึงโดนกูฆ่า
พวกมึงหัวเราะที่กูดูแปลก
กูขำที่พวกมึงธรรมดา
ไม่ต้องฟ้องแม่แล้วนอนร้องไห้ 
เดี๋ยวช่วยเอาตีนไปซับน้ำตา ไอสัส

HOOK
อยากใส่ Converse ละเข้าไปเตะหน้ามึง
ถีบสองตีนละกูก็เก๊กท่านึง
ฝากรอยตีนเอาไว้ที่แก้มมึงข้างนึง
ยั๊วะเลยไอ้สัส มึงทำกูเป็นอีกร่างนึง
อยากใส่ ช้างดาว วิ่งเข้าไปเตะหน้ามึง
กระโดดถีบสองตีน แล้วกูก็เก๊กท่านึ่ง
อยากฝากรอยตีนเอาไว้ที่แก้มมึงข้างนึง 
ยั๊วะเลยไอ้สัส มึงทำกูเป็นอีกร่างนึง ไอเหี้ย

OUTRO
อยากใส่ Nike ละเข้าไปเตะหน้ามึง
หมั่นไส้สัส มาทำเป็นดึงหน้าตึง
สไตล์กูเปรี้ยวจัด มันทำให้มึงหน้าบึ้ง
ยั๊วเลยไอสัส มึงทำกูเป็นอีกร่างนึง ไอเหี้ย"
9,ถามคำ,https://xn--72c9bva0i.meemodel.com//เนื้อเพลง/ถามคำ_URBOYTJ,"
HOOK
ถ้าเธอไม่ได้รักกับเขา เราจะได้รักกันไหม
เป็นคำถามที่ยังข้องใจ
เธอไม่รักเพราะมีเขา หรือว่าฉันไม่ใช่
เรื่องเดียวที่อยากรู้

PRE
แต่มันก็คงจะสายถ้าจะให้ฉันพูดออกไป
ก็เธอหนะมีเขาฉันก็ควรที่จะเข้าใจ
ก็แบบว่ามันยังคิดอยู่ อยากให้เธอลองคิดดู
ก็เผื่อว่าวันพรุ่งนี้เธอจะเปลี่ยนใจ
ตอนนี้คงทำได้เพียงแค่รอและมันก็คงต้องยอมก่อน
ก็แล้วจะให้ฉันทำยังไง
ก็แบบว่าถ้าเธอเหงาขึ้นมาเวลาที่ไม่มีใคร
ให้ฉันไปหาเธอได้ไหม

VERSE 1
ถ้าเกิดว่ามีความลับที่ฉันยังไม่อยากจะบอก
ถ้าเกิดว่ามีคำถามที่ไม่อยากได้ยินคำตอบ
ถ้าเกิดว่าไม่มีเค้า เธอจะมองฉันดูกระจอกไหม
ก็แบบว่าเอาจริงๆ ไม่อยากจะได้ยินคำปลอบใจ
ละถามว่ารักเธอไหม ฉันก็คงจะตอบว่ามากแหละ
แต่ถามว่าเกลียดเธอไหม บางทีมันก็ตอบยากแหละ
ก็แบบว่ามันไม่ทราบเลยที่จริงเธอคิดอะไรอยู่
บางทีก็ให้ความหวัง ชอบมาเล่นอะไรก็ไม่รู้

HOOK
ถ้าเธอไม่ได้รักกับเขา เราจะได้รักกันไหม
เป็นคำถามที่ยังข้องใจ
เธอไม่รักเพราะมีเขา หรือว่าฉันไม่ใช่
เรื่องเดียวที่อยากรู้
ถ้าเธอไม่ได้รักกับเขา เธอจะมองฉันบ้างไหม
ถ้าหากเราไม่เจอช้าไป
ถ้าหากไม่ใช่เขา จะเป็นฉันได้ไหม
หรือความจริงไม่ว่ายังไง 
เธอก็ไม่รักฉันอยู่ดี

VERSE 2
ที่ทักไปหาทุกวัน จะให้ฉันทำยังไงได้หละ
ถ้าเกิดว่าไม่มีเขาอะไรอะไรมันคงจะง่ายนะ
ก็แบบว่า ตอบได้มะ ว่าเป็นที่ฉันหรือเขา
ตอนนี้มันค้างคา ก็แบบว่าฉันไม่อยากจะเดาเลย
บางทีเธออยู่กับเค้าก็คิดว่าทำไมไม่ใช่เราวะ
ที่จริงก็รู้คำตอบ แต่ความจริงแล้วมันก็เศร้านะ
ช่างแม่งไม่อยากจะเล่าละ โซดาผสมกับเหล้านะ
ถ้าเกิดคืนนี้ฉันเมา โทรไปหาเธอไม่ต้องเดานะ
เธอคงจะอยู่กับเค้าอะ

HOOK
ถ้าเธอไม่ได้รักกับเขา เราจะได้รักกันไหม
เป็นคำถามที่ยังข้องใจ
เธอไม่รักเพราะมีเขา หรือว่าฉันไม่ใช่
เรื่องเดียวที่อยากรู้
ถ้าเธอไม่ได้รักกับเขา เธอจะมองฉันบ้างไหม
ถ้าหากเราไม่เจอช้าไป
ถ้าหากไม่ใช่เขา จะเป็นฉันได้ไหม
หรือความจริงไม่ว่ายังไง 
เธอก็ไม่รักฉันอยู่ดี

PRE
แต่มันก็คงจะสายถ้าจะให้ฉันพูดออกไป
ก็เธอหนะมีเขาฉันก็ควรที่จะเข้าใจ
ก็แบบว่ามันยังคิดอยู่ อยากให้เธอลองคิดดู
ก็เผื่อว่าวันพรุ่งนี้เธอจะเปลี่ยนใจ
ตอนนี้คงทำได้เพียงแค่รอและมันก็คงต้องยอมก่อน
ก็แล้วจะให้ฉันทำยังไง
ก็แบบว่าถ้าเธอเหงาขึ้นมาเวลาที่ไม่มีใคร
ให้ฉันไปหาเธอได้ไหม"
10,แบกไม่ไหว,https://xn--72c9bva0i.meemodel.com//เนื้อเพลง/แบกไม่ไหว_UrboyTJ,"
หนักเหลือเกินเหลือเกินเรื่องจริงที่เราต้องมาเผชิญ
เหนื่อยเหลือเกินเหลือเกินก็คงจะได้แค่ Let It Burn
เธอเองไม่ช่วยกันเลยซักนิด จะให้ฉันคิดยังไง
ต้องแบกความรักพังๆนี้ไว้ มันจะทนไม่ไหว
รักมันไม่เคยที่จะพอ เธอเหมือนไม่อยากจะไปต่อ
ฉันเองก็ชักจะเริ่มท้อ ควรที่จะต้องทำยังไง
ตอนนี้มันเริ่มไม่โอเค เธอไม่พอใจเธอก็เท
อยู่ต่อกันก่อนจะได้ไหม Baby

แบกคนเดียวไม่ไหว ฉันมันกำลังจะตาย
แบกคนเดียวไม่ไหว ฉันควรจะทำยังไง
แบกคนเดียวไม่ไหว รักที่มันพังทลาย
ต้องทนให้ไหว ไม่ให้เธอไป
Cuz’ ฉันยังอยากให้เธออยู่ Ouu Yeah

เธอบอกว่าเธอนั้นทนไม่ไหว เธอต้องการจะไป
เธอคงเบื่อ Warm Light ความรักของเรามันเก่าใช่ไหม
ฉันรู้ว่าฉันนั้นเคยผิดพลัง อยากขอโอกาสอีกครั้ง
แต่เธอกลับไม่สนใจปล่อยรักฉันตายลำพัง
เธอบอกว่าเราเข้ากันไม่ได้ ทั้งๆที่เราเคยเข้ากันบ่อย
ทุกๆวันนี้เวลาที่เจอเธอเหมือนเธอกินข้าวไม่อร่อย
ถ้าเธอนั้นต้องการจะจากไป ถ้ารั้งไม่ไหวฉันก็ต้องปล่อย
แค่อยากให้เธอยังอยู่กับฉันตรงนี้อีกหน่อย ฉัน...

แบกคนเดียวไม่ไหว ฉันมันกำลังจะตาย
แบกคนเดียวไม่ไหว ฉันควรจะทำยังไง
แบกคนเดียวไม่ไหว รักที่มันพังทลาย
ต้องทนให้ไหว ไม่ให้เธอไป
Cuz’ ฉันยังอยากให้เธออยู่ Ouu Yeah"
11,แป๊บ,https://xn--72c9bva0i.meemodel.com//เนื้อเพลง/แป๊บ_URBOYTJ,"
Hook
เธอบอกอาบน้ำแปปแล้วเธอก็หาย
หรือเธอจะ say goodbye แล้วหนีฉันไป
อยากมีเธอมาอิง ไม่อยากจะถูกทิ้งเอาไว้เลย
Cuz I, ไม่อยากจะให้เธอหายไปไหน
Oh, please please please please

Verse 1
เอาดีดี นี่เธอจะรักหรือเธอจะหลอกอะ
คุยกันสักพักเดี๋ยวเธอก็ on เดี๋ยวเธอก็ off อะ
ก็ไม่เข้าใจอยู่ดีๆก็ไม่ค่อยตอบอะ
ใจร้ายจริง ทำไงเธอถึงจะชอบอะ
I aint got nothing If i aint got you
อย่าให้ฉันรอนานอะได้ไหมอะ my boo
Oh baby please please please please

Hook
เธอบอกอาบน้ำแปปแล้วเธอก็หาย
หรือเธอจะ say goodbye แล้วหนีฉันไป
อยากมีเธอมาอิง ไม่อยากจะถูกทิ้งเอาไว้เลย
Cuz I, ไม่อยากจะให้เธอหายไปไหน
Oh, please please please please

Verse 2 
ให้รอนานๆไม่คิดถึงฉันบ้างหรือไง 
มันนานเกินไปรู้หรือเปล่า
เธอจะทำวิ้ง จะเนียนเด้งไปแค่ไหน
ถ้านานเกินไป ฉันจะทนไม่ไหว

Pre
แบบว่าคิดถึงเธอจะแย่อะ
ไลน์ไม่ตอบแน่ๆอะ
เอาจริงอยากให้แก้อะ
ไม่งั้นฉันคงแย่อะ
เล่นหายไปนานๆ 
แบบนี้มันเริ่มทำให้ฉันแบบว่าโครตจะ sad อะ
(แย่อะ)

Hook
เธอบอกอาบน้ำแปปแล้วเธอก็หาย
หรือเธอจะ say goodbye แล้วหนีฉันไป
อยากมีเธอมาอิง ไม่อยากจะถูกทิ้งเอาไว้เลย
Cuz I, ไม่อยากจะให้เธอหายไปไหน

Oh, please please please please

Pre
แบบว่าคิดถึงเธอจะแย่อะ
ไลน์ไม่ตอบแน่ๆอะ
เอาจริงอยากให้แก้อะ
ไม่งั้นฉันคงแย่อะ
เล่นหายไปนานๆ 
แบบนี้มันเริ่มทำให้ฉันแบบว่าโครตจะ sad อะ
(แย่อะ)

Hook
เธอบอกอาบน้ำแปปแล้วเธอก็หาย
หรือเธอจะ say goodbye แล้วหนีฉันไป
อยากมีเธอมาอิง ไม่อยากจะถูกทิ้งเอาไว้เลย
Cuz I, ไม่อยากจะให้เธอหายไปไหน

Pre
แบบว่าคิดถึงเธอจะแย่อะ
ไลน์ไม่ตอบแน่ๆอะ
เอาจริงอยากให้แก้อะ
ไม่งั้นฉันคงแย่อะ
เล่นหายไปนานๆ 
แบบนี้มันเริ่มทำให้ฉันแบบว่าโครตจะ sad อะ
(แย่อะ)"
12,ไปด้วยกัน,https://xn--72c9bva0i.meemodel.com//เนื้อเพลง/ไปด้วยกัน_URBOYTJ,"
VERSE 1
เขาบอกว่าแพ้เป็นพระ แต่อยากชนะมั่งสักวัน
อยากถูกเค้าชื่นชม รสชาติมันเป็นแบบไหนกัน
เรื่องง่ายๆ ที่ใครต่อใครก็ทำได้หมด
เรื่องยากๆ ที่มันต้องยอมต้องทนต้องอด
ก็มีแค่คนที่อดทน แค่เท่านั้นที่ทำได้

PRE
มีเธอข้างกาย I might not cry
ถึงจะล้มไปสักกี่ครั้ง ขอแค่มีเธอเห็นใจ
สูดลมหายใจเข้าปอด แล้วบอกว่า ลองดูสักครั้ง
มันอาจจะแพ้มากี่ครั้ง มากี่ครั้ง ก็ช่างมัน
แค่ซักหนึ่งครั้ง ครั้งสุดท้าย ต้องชนะ 
Ay Ay ไม่ต้องห่วง ฉันต้องทำได้ในซักวัน

HOOK
ต่อให้มันหนาวเหน็บหนาวฉันก็จะกอดเธอเอาไว้
ไม่ว่าลมแรงแค่ไหนเดี๋ยวมันก็พัดผ่านเราไป
ในใจมันขอแค่มี มีเธออยู่ข้างกาย
ปัญหามากมายก็ come on come on come on
เราก็จะฮึบไปด้วยกัน

VERSE 2
I don’t know  I don’t know
I don’t know  ฉันไม่รู้
ว่าข้างหน้ามันจะเป็นเช่นไร
แค่มีเธอ แค่มีเธอ  คอยมาเป็นกำลังใจ
เจออะไรมา ฉันก็ไม่กลัว
เรื่องง่ายๆ ที่ใครต่อใครก็ทำได้หมด
เรื่องยากๆ ที่มันต้องยอมต้องทนต้องอด
ก็มีแค่คนที่อดทน แค่เท่านั้นที่ทำได้

PRE
มีเธอข้างกาย I might not cry
ถึงจะล้มไปสักกี่ครั้ง ขอแค่มีเธอเห็นใจ
สูดลมหายใจเข้าปอด แล้วบอกว่า ลองดูสักครั้ง
มันอาจจะแพ้มากี่ครั้ง มากี่ครั้ง ก็ช่างมัน
แค่ซักหนึ่งครั้ง ครั้งสุดท้าย ต้องชนะ 
Ay Ay ไม่ต้องห่วง ฉันต้องทำได้ในซักวัน

HOOK
ต่อให้มันหนาวเหน็บหนาวฉันก็จะกอดเธอเอาไว้
ไม่ว่าลมแรงแค่ไหนเดี๋ยวมันก็พัดผ่านเราไป
ในใจมันขอแค่มี มีเธออยู่ข้างกาย
ปัญหามากมายก็ come on come on come on
เราก็จะฮึบไปด้วยกัน

RAP
เบื่อแล้วงาน พอแล้วคิดไรไม่ออก
หมดพลัง แก้สิบปีก็ไม่จบ
อยากเติมพลังอีกครั้ง ไฟเรายังคงไม่หมด
จุดไฟขึ้นมาลองกับมันอีกซักหยด
ฮึบเดะ อย่าไปร้อง 
ปาดน้ำตาฮึบเอาไว้แบบแม่บอก
ก็กรึ๊บเดะ อย่าไปท้อ 
พยายามจนหยดสุดท้าย ไม่มีคำว่าแพ้หรอก"
