,name,link,lyrics
21,วายร้าย,https://xn--72c9bva0i.meemodel.com//เนื้อเพลง/วายร้าย_URBOYTJ,"
คุณหนะนางเอก
ผมหนะตัวร้าย
ตอนจบ คุณก็รู้ ผมก็ต้องตาย
กลับตัวกลับใจมันก็คงไม่ทัน
ถ้าผมเป็นคนดี หนังเรื่องนี้ก็คงไม่มันเดะ
เอาเดะ
ยอมตายเพื่อคุณ ทำไงได้ ผมก็ได้แค่นี้อะเดะ
เนี้ยอะเดะ
Spiderman กับ Mary Jane
ก็ต้องอยู่ด้วยกันอะเดะ

เธอมีโลกของเธอ ฉันมีโลกของฉัน
คงจะไม่มีวันที่เราจะได้รักกัน
นิยายขายดี ก็ต้องมีวายร้าย
และฉันก็รู้ดี

ฉันมันแค่วายร้าย เป็นได้ก็แค่นั้น
จะสู้จะรักแค่ไหนก็คงต้องแพ้ต้องเจ็บใจไปทุกครั้ง
ยอมเป็นวายร้ายแค่เพียงได้มองหน้าเธอ
สุดท้ายฉันก็ต้องตาย
ก็มันเป็นแค่นิยาย
จบแล้วสำหรับวายร้ายอย่างฉัน

ผมคือ Darth Vader คุณคือ Skywalker
ผมคือ Stormtrooper คุณคือ Rebelion
เส้นทางของเราไม่มีวันมาประจบกัน
เหมือนกับสายน้ำที่ไม่มีวันย้อนกลับมาหากันอีก
Okay ตัวร้ายกับนางเอก Baby
ผมเลวและผมก็เกเร
Anyway we're in different world girl

เธอมีโลกของเธอ ฉันมีโลกของฉัน
คงจะไม่มีวันที่เราจะได้รักกัน
นิยายขายดี ก็ต้องมีวายร้าย
และฉันก็รู้ดี

ฉันมันแค่วายร้าย เป็นได้ก็แค่นั้น
จะสู้จะรักแค่ไหนก็คงต้องแพ้ต้องเจ็บใจไปทุกครั้ง
ยอมเป็นวายร้ายแค่เพียงได้มองหน้าเธอ
สุดท้ายฉันก็ต้องตาย
ก็มันเป็นแค่นิยาย
จบแล้วสำหรับวายร้ายอย่างฉัน

โอย กูหนะโครตวายร้ายละจะโทษใครได้
But u ชอบ my style gangster
ไม่ต้องทาย อุยตาย look into my eyes
ตาแดง smoking j till I die
Baby don't cry ถ้าผมหนะใจร้าย
U and I จบกันไม่ดีมันน่าเสียดาย
Let me hit u one more time make u smile
จำได้ไหม used to be mine
ก็เนี่ยคือใคร sunny day ไง เธอก็บาย
เอากันง่ายๆ โอย กูจะตาย
ก็เพราะอะไรอะ

ฉันมันแค่วายร้าย เป็นได้ก็แค่นั้น
จะสู้จะรักแค่ไหนก็คงต้องแพ้ต้องเจ็บใจไปทุกครั้ง
ยอมเป็นวายร้ายแค่เพียงได้มองหน้าเธอ
สุดท้ายฉันก็ต้องตาย
ก็มันเป็นแค่นิยาย
จบแล้วสำหรับวายร้ายอย่างฉัน"
22,สักวัน,https://xn--72c9bva0i.meemodel.com//เนื้อเพลง/สักวัน_URBOYTJ,"
Produced By URBOYTJ
Featuring Karn The Parkinson
Arranged By Jirayut Phaloprakarn
Composed By Jirayut Phaloprakarn, Nipat Kamjornpreecha
Written By Jirayut Phaloprakarn, Nipat Kamjornpreecha
Piano by Janpat Montrelerdrasme
Guitar by Prateep Siri-Issranan, Nipat Kamjornpreecha
Mixed By Jason Agel
Mastered By Randy Merrill

HOOK
ฉันพยายามทำให้เธอมารักกัน
แต่สิ่งที่ทำไม่ได้เป็นอย่างที่ฉันหวัง

ซักวันฉันจะไม่ต้องเอาใจใคร
ซักวันฉันจะทำตามเสียงหัวใจ
ซักวันฉันจะไม่ต้องนอนร้องไห้
No more cry , through the night
ซักวันฉันจะยิ้มเหมือนอย่างใครๆ
ซักวันฉันจะอยู่คนเดียวให้ได้
ซักวันนึงที่ฉันต้องจากเธอไป
ไม่เป็นไร, I’ll be fine

VERSE 1
พยายามจะไม่ขี้แย
พยายามให้เธอมาแคร์
พยายามเท่าไหร่ก็แพ้
พยายามไปก็ไม่แฟร์
พยายามจะเป็นอย่างเค้า
พยายามเธอก็ไม่เอา
พยายามให้ตายก็เศร้า
แต่ว่าซักวัน

HOOK,

VERSE 2
ซักวันฉันจะมีกำลัง
ซักวันฉันจะมีความหวัง
ซักวันชีวิตจะไม่พัง
ซักวันฉันจะทำให้ดี
ซักวันฉันไม่อยู่ตรงนี้
ซักวันเธอคงลืมฉันไป
ซักวันที่ฉันตายลงไป
ไม่ต้องเสียใจ

BRIDGE
แค่บางทีหมดแรงจะไปต่อ
แค่บางทีที่ใจทนไม่ไหว
แค่วันที่ไม่เหลือใคร แค่อยากหายไป
แค่ไม่พร้อมจะอยู่ตรงนี้
แค่อีกวันที่เธอไม่เห็นค่า
แค่อีกวันที่ฉันเสียน้ำตา
แต่คงมีสักวันนะ สักวันนะ จะต้องดีกว่านี้

HOOK
ฉันพยายามทำให้เธอมารักกัน
ฉันพยายามเป็นทุกอย่างที่เธอใฝ่ฝัน
ฉันพยายามทำให้เธอมารักฉัน
แต่สิ่งที่ทำไม่ได้เป็นอย่างที่ฉันหวัง

BRIDGE
มันเหนื่อยจนพูดไม่ออกละบอกไม่ได้เว้ย 
มันท้อจนอยากจะพอ ไม่อยากไปต่อเว้ย
Sometimes I feel like I ไม่อยากจะอยู่เว้ย
Sometimes I feel like..."
23,หลับตา,https://xn--72c9bva0i.meemodel.com//เนื้อเพลง/หลับตา_URBOYTJ,"
VERSE 1
ในวันที่ฉันต้องเจอปัญหามากมาย
ในวันที่มองทางไหนก็ไม่เห็นใคร
ในวันที่ฉันนั้นแทบจะไร้เรี่ยวแรง
มีใครบ้างไหมที่จะมากอดฉันไว้
คิดถึงในตอนที่ฉันหน่ะเป็นแค่เด็ก
เจ็บมากแค่ไหน ก็ร้องแบบไม่ต้องอาย
แต่ตอนนี้ฉันมันทำแบบนั้นไม่ได้
อ่อนแออย่างนี้จะมีใครมาเข้าใจ

PRE
แค่อยากนอนหลับตาไม่ต้องตื่น
ไม่อยากทำเป็นฝืนว่าแข็งแรง
ที่ทำเป็นเก่งที่จริงก็เป็นได้เพียงไอคนขี้แพ้
แค่อยากที่จะร้องไห้กับใครสักคน

VERSE 2
ไม่มีใครถามว่าฉันโอเคหรือปล่าว
ต้องทนเจ็บช้ำมากมายกี่ร้อยเรื่องราว
วันนี้ที่ฉันนั้นมันยังหายใจอยู่
ไม่มีใครรู้จะทนได้นานแค่ไหน
ที่เห็นว่าฉันหนะยิ้มให้เธอทุกวัน
ข้างในของฉัน มันแทบไม่ไหวแล้วเธอ
น้ำตาของฉันที่พยายามจะเก็บ
ในวันนี้มันเจ็บจนแทบจะตาย

PRE
แค่อยากนอนหลับตาไม่ต้องตื่น
ไม่อยากทำเป็นฝืนว่าแข็งแรง
ที่ทำเป็นเก่งที่จริงก็เป็นได้เพียงไอคนขี้แพ้
แค่อยากที่จะร้องไห้กับใครสักคน

RAP
เพราะตอนนี้ฉันอ่อนแอ แล้วก็ท้อแท้ชะมัด
แต่ฉันแค่ทำเป็นเก่งและทำเป็นแอ็คไปงั้น
บางทีปัญหาเข้ามาติดติดกันแยะไปนะ
อยากพูดกับใครซักคนแต่ไม่มีอารมณ์แม้จะทัก
ไม่อยากจะแคร์ ไม่อยากจะแนะใครละ
อะไรจะเกิดก็เกิด ช่างแม่งเหอะแล้วไงวะ
ทำไม ทำไม ทำไมจะต้องไป Sad ไรนัก 
มันเบื่อแบบแทบไม่ไหวจนอยากยอมแพ้ไปซะ  

PRE
แค่อยากนอนหลับตาไม่ต้องตื่น
ไม่อยากทำเป็นฝืนว่าแข็งแรง
ที่ทำเป็นเก่งที่จริงก็เป็นได้เพียงไอคนขี้แพ้
แค่อยากที่จะร้องไห้กับใครสักคน"
24,อยู่ก่อน,https://xn--72c9bva0i.meemodel.com//เนื้อเพลง/อยู่ก่อน_URBOYTJ,"
VERSE1
One, two, three, and to the four
ถึงผมไม่ใช่ Snoop but I got my flow
คงไม่ได้เห็นผมอยู่ใน Club ถ้าไม่ได้ Do my show
ไม่ได้ Cruising down the street เพราะไม่มี 64
ไม่ชอบเที่ยวกลางคืนอยู่แต่ในคอนโด
นั่งอยู่บนโซฟาเล่นแต่ Nintendo 
ไว้ถ้าคุณมาอยู่ด้วย อยากชวนคุณดู Nemo
เปิดแอร์เย็นๆ แล้วชวนมาดูดปีโป้

PRE
อยากจะได้อะไรขอแค่เธอหนะบอกมา
Anything you want ไม่ต้องเสียเวลาหา
ถ้าไม่ว่าอะไรจะชวนเล่นฟีฟ่า
Ma baby, yeah
มีเธออยู่ด้วยกันมันก็คงจะดีโคตร
อยากให้เราสนิทเหมือน Stitch กับ Lilo
ก็คืนนี้มันเหงาไม่เอาอีกแล้ว
Cuz I need you right now

HOOK (OAT PRAMOTE)
อย่าเพิ่งไปไหนได้ไหมช่วยทำให้ฉันฝันดี
ถ้าหากคืนนี้เธอเองก็เหงาอยู่เหมือนกัน
ดึกดื่นอย่างนี้มันคงจะดีถ้าเธออยู่กับฉัน
จะกลับไปเหงาทำไมคนเดียว ฉันว่าเราควรอยู่ด้วยกัน

VERSE2
ไม่ได้อยากจะเซ้าซี้ แต่อยากให้เธออยู่ต่อ
ไม่ทำอะไรเธอชัวร์ ไม่ต้องกลัวพ่อดุหรอก
มานอนดู Netflix with my big TV
แล้วเอาแขนผมไปหนุน อุ่นเหมือนกอดพี่หมี 
ก็แบบว่าว่างนะวันนี้ไม่มีแขก
อย่าไปเชื่อเค้าที่ใครบอกว่าผมแสบ
เงินผมแม่งหนาสัสนับไม่ไหวก็คงไม่แปลก 
ถึงผมจะมีพุงแต่ก็แปลว่ามีแดก 
อยากให้ถอดเสื้อออก ไม่ต้องมีหรอก
แบบว่าเธอหน่ะ Sexy ทำผมแทบเลือดออก
นี้พูดจริงๆนะไม่ได้แค่เพื่อหยอก
ถอดไม่ออกเดี๋ยวผมถอดให้ปะ

HOOK (OAT PRAMOTE)
อย่าเพิ่งไปไหนได้ไหมช่วยทำให้ฉันฝันดี
ถ้าหากคืนนี้เธอเองก็เหงาอยู่เหมือนกัน
ดึกดื่นอย่างนี้มันคงจะดีถ้าเธออยู่กับฉัน
จะกลับไปเหงาทำไมคนเดียว ฉันว่าเราควรอยู่ด้วยกัน

BRIDGE (TJ) 
อยู่กับฉันนานๆนะเธอ
ก็คืนนี้มันช่างหนาวและเหงาเหลือเกิน
ถ้าเธอกลัวให้กอดฉันไว้ I’ll make love to you tonight 
ขอได้ไหม ได้ไหม มาข้ามคืนนี้ไปด้วยกัน

HOOK (TJ + OAT PRAMOTE)
อย่าเพิ่งไปไหนได้ไหมช่วยทำให้ฉันฝันดี
ถ้าหากคืนนี้เธอเองก็เหงาอยู่เหมือนกัน
ดึกดื่นอย่างนี้มันคงจะดีถ้าเธออยู่กับฉัน
จะกลับไปเหงาทำไมคนเดียว ฉันว่าเราควรอยู่ด้วยกัน"
25,ออกมาดิ,https://xn--72c9bva0i.meemodel.com//เนื้อเพลง/ออกมาดิ_UrboyTJ,"
HOOK
ออกมาดิ ออกมาเดะ ถ้ามีดีก็เอามาดู
ออกมาดิ ออกมาเดะ show me show me what u got
ออกมาดิ ออกมาเดะ ถ้ามีดีก็เอามาดู
อย่ามัวแต่เสียเวลงเวลาไม่ทำอะไร

VERSE 1
put my jacket on 
เช็ค tag ดูมันฟ้องว่า saint laurent's on me
skinny jeans black tee and I got that C
กด beat อยู่ในห้อง กูทำมาตั้งแต่ 14
กูเป็นกู กูเป็นกู ไม่ตามใครๆ
ใครจะพูด ว่าไม่ good ก็ไม่เป็นไร
look at me look at me , im on fire
we do it big it’s ride or die
เรียกกูว่า chef ที่ cook อยู่หลัง bar
ผสม that bass with the guitar
spit that ไฟ ออกไปใส่จากไมค์
u see me ไหม? ไหม้กว่า lava
ไม่เสียเวลาไปกับสิ่งที่คนพูด
ทำในสิ่งที่เราคิดว่าเราถูก
ชูมือกันขึ้นมา we do it like a rockstar

VERSE 2
ayo whats good , คนจริงเค้าไม่มาเสียเวลาพูด
it's การกระทำกับ attitude มันคือสิ่งที่พิสูจน์
so ตราหน้าเข้ามา boy, cuz เวลากูมีน้อย 
jiggo with zippo แล้วมึงก็รู้ it’s urboy 
กูใส่ biker นั่งอยู่บน honda สักทั้งตัวอย่างกับยากูซ่า
ทุบ guitar like a rockstar ยังไม่ get อีกหรอวะ
ไม่เสียเวลาไปกับสิ่งที่คนพูด
ทำในสิ่งที่เราคิดว่าเราถูก
ชูมือกันขึ้นมา do it like a rockstar"
